{
  "id": "location-barrel-and-bullet-saloon",
  "type": "location",
  "title": "Barrel & Bullet Saloon",
  "campaignId": "mornqar-alkenstar",
  "summary": "A rough but dependable saloon in Alkenstar's Ferrous Quarter that serves as a safehouse, job hub, and the party's opening heist briefing point.",
  "tags": [
    "saloon",
    "safehouse",
    "meeting-place",
    "ferrous-quarter",
    "underworld",
    "base-of-operations",
    "crafting",
    "lodging",
    "heist-hub",
    "opening-location"
  ],
  "parentLocationId": "location-alkenstar",
  "relations": []
}
